{"url": "https://www.facebook.com/helperase/photos/a.1029649477086727/2703988382986153/?type=3", "created_time": "2019-11-01T14:50:52+0000", "message": "Without the support of people we could not do what we do. The #HelpERASE online community is \ud83d\udd25AMAZING\ud83d\udd25. We can\u2019t say thank you enough. This is one of our many supporters. Donations go directly to helping survivors and training law enforcement. \u2764\ufe0f\u2764\ufe0f\u2764\ufe0f Thank you @jbrettsalazar \n\n#Repost @jbrettsalazar\n\u30fb\u30fb\u30fb\nErase Child Trafficking. Help donate to a good cause. \nFor my birthday month November I have asked friends and family NOT to buy me a gift. Rather donate money to a good cause.\n\nFor my birthday month November 2019 I am also asking friends and family NOT to buy me a gift. Rather donate money to a good cause.\n\nHuman Trafficking occurs when a human being is sold, traded, transferred, or otherwise exchanged in some way for money, sex, labor, or other commodities.\n\nThe solution to end child trafficking involves law enforcement training, public education, and victim services. Save a life in YOUR neighborhood - Donate.\n\nNo matter how much you choose to give, your gift will make a difference in the lives of trafficking victims. \nFor additional information visit Erase Child Trafficking website. Link below. Or you may GOOGLE Erase Child Trafficking.\n\nDonate OPTIONs either on:\n\ud83d\udd39\ufe0f Facebook: https://www.facebook.com/helperase/\nOR\n\ud83d\udd39\ufe0fWebsite: https://www.erasechildtrafficking.org/ THEN click on RED \"donate\" button.\nOR\nIf you are having an issue donating on website or Facebook you may call (800) 819-3727 and this number is on website link mentioned in this post.", "cleaned_message": ["without", "support", "peopl", "could", "onlin", "commun", "amaz", "say", "thank", "enough", "one", "mani", "support", "donat", "go", "directli", "help", "survivor", "train", "law", "enforc", "thank", "eras", "child", "traffick", "help", "donat", "good", "caus", "birthday", "month", "novemb", "ask", "friend", "famili", "buy", "gift", "rather", "donat", "money", "good", "caus", "birthday", "month", "novemb", "also", "ask", "friend", "famili", "buy", "gift", "rather", "donat", "money", "good", "caus", "human", "traffick", "occur", "human", "sold", "trade", "transfer", "otherwis", "exchang", "way", "money", "sex", "labor", "commod", "solut", "end", "child", "traffick", "involv", "law", "enforc", "train", "public", "educ", "victim", "servic", "save", "life", "neighborhood", "-", "donat", "matter", "much", "choos", "give", "gift", "make", "differ", "live", "traffick", "victim", "addit", "inform", "visit", "eras", "child", "traffick", "websit", "link", "may", "googl", "eras", "child", "traffick", "donat", "option", "either", "facebook", "websit", "click", "red", "donat", "button", "issu", "donat", "websit", "facebook", "may", "call", "-", "number", "websit", "link", "mention", "post"], "emojis": ["\ud83d\udd25", "\ud83d\udd25", "\u2764", "\u2764", "\u2764", "\ud83d\udd39", "\ud83d\udd39"], "mentions": ["jbrettsalazar", "jbrettsalazar"], "names": null, "message_tags": ["ERASE Child Trafficking", "helpERASE", "Repost"], "attachments": [{"media_type": "photo", "media_url": "https://www.facebook.com/helperase/photos/a.1029649477086727/2703988382986153/?type=3", "media_description": "Timeline Photos", "thumbnail_url": null}], "urls": ["https://www.facebook.com/helperase/", "https://www.erasechildtrafficking.org/"], "date": "2019-11-01", "day_week": 4, "Mon": 0, "Tue": 0, "Wed": 0, "Thur": 0, "Fri": 1, "Sat": 0, "event": 0, "winter": 0, "spring": 0, "summer": 0, "hour": 14, "morning": 0, "afternoon": 1, "evening": 0, "share": 0, "share_url": null, "photo": 1, "photo_url": "https://www.facebook.com/helperase/photos/a.1029649477086727/2703988382986153/?type=3", "video": 0, "video_url": null, "media_desc": ["Timeline Photos"], "thumbnail_url": [null], "link": 1, "link_url": ["https://www.facebook.com/helperase/", "https://www.erasechildtrafficking.org/"], "total_engagement": 20, "engagement_rate": 52.92405398, "reactions": 13, "shares": 4, "comments": 3}